{
  "format_version": 1,
  "id": "prefab://player",
  "name": "3D Player",
  "entities": [{
    "id": "body",
    "name": "Player Cube",
    "components": {
      "Transform3D": {"position":[0.0,0.5,0.0],"rotation":[0.0,0.0,0.0],"scale":[1.0,1.0,1.0]},
      "MeshRenderer": {"shape":"cube","size":[1.0,1.0,1.0],"color":[0.36,0.67,0.93,1.0],"texture":"asset://textures/checker","wireframe":false},
      "BoxCollider3D": {"size":[1.0,1.0,1.0],"offset":[0.0,0.0,0.0],"is_trigger":false,"layer":"player"},
      "CharacterController3D": {
        "step_height":0.35,
        "slope_limit":50.0,
        "skin_width":0.02,
        "gravity":-20.0
      },
      "LuaScript": {"module":"script://scripts/player_3d.lua"}
    }
  }]
}
