{
  "format_version": 1,
  "id": "prefab://third_person_controller",
  "name": "Third-Person Controller",
  "entities": [
    {
      "id": "body",
      "name": "Player Body",
      "tags": ["player", "animation-state-extension-point"],
      "components": {
        "Transform3D": {"position": [0, 1, 0], "rotation": [0, 0, 0], "scale": [1, 1, 1]},
        "MeshRenderer": {"shape": "capsule", "size": [0.7, 1.8, 0.7], "color": [0.3, 0.7, 1, 1]},
        "CapsuleCollider3D": {"radius": 0.35, "height": 1.8, "offset": [0, 0, 0], "layer": "player"},
        "CharacterController3D": {"step_height": 0.3, "slope_limit": 50, "skin_width": 0.02, "gravity": -20},
        "LuaScript": {"module": "script://scripts/controllers/character_3d.lua", "properties": {"speed": 5.0, "jump_speed": 7.0}}
      }
    },
    {
      "id": "camera",
      "name": "Third-Person Camera Rig",
      "components": {
        "Transform3D": {"parent": "body", "position": [0, 3, 6], "rotation": [0, 0, 0], "scale": [1, 1, 1]},
        "Camera3D": {"primary": true, "fov": 60, "near_clip": 0.05, "far_clip": 250, "target_offset": [0, -2, -6]}
      }
    }
  ]
}
