{
  "format_version": 1,
  "id": "prefab://obstacle",
  "name": "Obstacle Prop",
  "entities": [{
    "id": "body",
    "name": "Obstacle Wall",
    "components": {
      "Transform3D": {"position":[0.0,1.0,0.0],"rotation":[0.0,0.0,0.0],"scale":[1.0,1.0,1.0]},
      "MeshRenderer": {"shape":"cube","size":[1.0,2.0,4.0],"color":[0.85,0.42,0.36,1.0],"wireframe":false},
      "BoxCollider3D": {"size":[1.0,2.0,4.0],"offset":[0.0,0.0,0.0],"is_trigger":false,"layer":"obstacle"},
      "Rigidbody3D": {"body_type":"static","velocity":[0.0,0.0,0.0],"use_gravity":false,"gravity_scale":0.0}
    }
  }]
}
