{
  "format_version": 1,
  "id": "prefab://pickup",
  "name": "Pickup",
  "entities": [{
    "id": "body",
    "components": {
      "Transform3D": {"position": [0, 0.5, 0], "rotation": [0, 0, 0], "scale": [1, 1, 1]},
      "MeshRenderer": {"shape": "sphere", "size": [0.5, 0.5, 0.5], "color": [1, 0.8, 0.2, 1]},
      "SphereCollider3D": {"radius": 0.3, "is_trigger": true, "layer": "pickup"},
      "LuaScript": {"module": "script://scripts/controllers/pickup.lua"}
    }
  }]
}
