{
  "format_version": 1,
  "id": "scene://water_interaction_3d/main",
  "name": "Opt-in water gameplay",
  "entities": [
    {
      "id": "terrain",
      "components": {
        "Transform3D": {},
        "Terrain3D": {
          "asset": "asset://water_interaction/lake"
        }
      }
    },
    {
      "id": "floating_body",
      "components": {
        "Transform3D": {
          "position": [
            16,
            5,
            16
          ]
        },
        "MeshRenderer": {
          "shape": "sphere",
          "size": [
            1,
            1,
            1
          ],
          "color": [
            0.9,
            0.65,
            0.15,
            1
          ]
        },
        "SphereCollider3D": {
          "radius": 0.5
        },
        "Rigidbody3D": {
          "body_type": "dynamic",
          "mass": 3,
          "use_gravity": true,
          "linear_damping": 0,
          "allow_sleep": false
        },
        "LuaScript": {
          "module": "script://scripts/float.lua"
        }
      }
    },
    {
      "id": "swimmer",
      "components": {
        "Transform3D": {
          "position": [
            12,
            1,
            12
          ]
        },
        "MeshRenderer": {
          "shape": "sphere",
          "size": [
            0.7,
            0.7,
            0.7
          ],
          "color": [
            0.8,
            0.15,
            0.1,
            1
          ]
        },
        "SphereCollider3D": {
          "radius": 0.35
        },
        "Rigidbody3D": {
          "body_type": "dynamic",
          "mass": 3,
          "use_gravity": false,
          "linear_damping": 0,
          "allow_sleep": false
        },
        "LuaScript": {
          "module": "script://scripts/swimmer.lua"
        }
      }
    },
    {
      "id": "air_control",
      "components": {
        "Transform3D": {
          "position": [
            3,
            6,
            3
          ]
        },
        "MeshRenderer": {
          "shape": "sphere",
          "size": [
            0.7,
            0.7,
            0.7
          ],
          "color": [
            0.8,
            0.8,
            0.8,
            1
          ]
        },
        "SphereCollider3D": {
          "radius": 0.35
        },
        "Rigidbody3D": {
          "body_type": "dynamic",
          "mass": 3,
          "use_gravity": false,
          "linear_damping": 0,
          "allow_sleep": false
        },
        "LuaScript": {
          "module": "script://scripts/float.lua"
        }
      }
    },
    {
      "id": "camera",
      "components": {
        "Transform3D": {
          "position": [
            16,
            26,
            42
          ]
        },
        "Camera3D": {
          "target_offset": [
            0,
            -23,
            -26
          ],
          "far_clip": 160,
          "fov": 55,
          "clear_color": [
            0.15,
            0.22,
            0.3,
            1
          ]
        }
      }
    },
    {
      "id": "sun",
      "components": {
        "DirectionalLight": {
          "direction": [
            -0.5,
            -1,
            -0.3
          ],
          "intensity": 1.3
        }
      }
    },
    {
      "id": "environment",
      "components": {
        "Environment3D": {
          "ambient_intensity": 0.3
        }
      }
    }
  ]
}
